{
  "contract_version": "distribution-manifest/2",
  "source_revision": "sha256:de84b33564470c519327deef706a72a9e974c0651d9c71228a7765cf9bb10b4c",
  "generator_version": "1.0.0",
  "installed": [
    {
      "path": ".claude-plugin/plugin.json",
      "source": "src/claude/.claude-plugin/plugin.json",
      "digest": "sha256:90bfe5332f8deae56cd38e20542ae9c63fc9f8611b86c3625cb235731eb0e79c"
    },
    {
      "path": "agents/domain-modeler.md",
      "source": "src/claude/agents/domain-modeler.md",
      "digest": "sha256:9065470f832e629c26d4b8b79eb9ea1fb02d04a1f1c05d60a138b00f19c8082e"
    },
    {
      "path": "agents/impact-analyst.md",
      "source": "src/claude/agents/impact-analyst.md",
      "digest": "sha256:35f9eb37b5653745e2ca3568d974a9ae6acadfff837ff0ff4678879c167b8907"
    },
    {
      "path": "agents/knowledge-enricher.md",
      "source": "src/claude/agents/knowledge-enricher.md",
      "digest": "sha256:8c37d272239a8155c99bf3874d4a324ff34aab5b9adce8e9d645475a90224158"
    },
    {
      "path": "bin/check_field_ownership.py",
      "source": "src/claude/bin/check_field_ownership.py",
      "digest": "sha256:c62c9189911f16b17f2a0985c33659ee3225fbd1bc660d03fc7fd28fd5f0e2cb"
    },
    {
      "path": "bin/check_knowledge.py",
      "source": "src/claude/bin/check_knowledge.py",
      "digest": "sha256:122a968fccede5a36e8707c41de62561d8edfeb4f395b74613e484412760c510"
    },
    {
      "path": "bin/field_ownership.py",
      "source": "src/claude/bin/field_ownership.py",
      "digest": "sha256:b27a5abc8ced22144e331937ca8b5c64ccc65a65053a8bff5d72022f369939bf"
    },
    {
      "path": "bin/materialize.py",
      "source": "src/claude/bin/materialize.py",
      "digest": "sha256:8a484c9342666788bd814aa010757d82511bbe6b92636b8c4267618b62723a64"
    },
    {
      "path": "bin/seal_analysis.py",
      "source": "src/claude/bin/seal_analysis.py",
      "digest": "sha256:e5040bc9614174eb99d35c83908023b27315261ef24f126ae68f656b0764ac2b"
    },
    {
      "path": "schemas/analysis-record.json",
      "source": "src/claude/schemas/analysis-record.json",
      "digest": "sha256:645ef6d57e0def93fa9d863bc3d379afd81b1a9f09cf8c2698968f8d922a46db"
    },
    {
      "path": "schemas/analysis-seal.json",
      "source": "src/claude/schemas/analysis-seal.json",
      "digest": "sha256:efb5d28bf63b4d017bc9b122dc09f6f3bfd8f4259852ef391ebbe4de275ef111"
    },
    {
      "path": "schemas/distribution-manifest.json",
      "source": "src/claude/schemas/distribution-manifest.json",
      "digest": "sha256:7a849b5965768d3ad4a6f2d3c9d705f4562684733f2c59fd938dd6565ef2f135"
    },
    {
      "path": "schemas/domain-object.json",
      "source": "src/claude/schemas/domain-object.json",
      "digest": "sha256:d3d805d8151478156562889865d088d75ea079f888b6508db2a66d85b5fcbfa6"
    },
    {
      "path": "schemas/impact-analysis.json",
      "source": "src/claude/schemas/impact-analysis.json",
      "digest": "sha256:c08d2ecf620ab148450bc617dcfd948268f8f1a2487e6263c83fc4cdaa4ad602"
    },
    {
      "path": "schemas/knowledge-decision.json",
      "source": "src/claude/schemas/knowledge-decision.json",
      "digest": "sha256:65db993767577dfde95559f91f993e8adc83f6d54cadae381bcdf3d0357181a4"
    },
    {
      "path": "schemas/knowledge-enrichment-result.json",
      "source": "src/claude/schemas/knowledge-enrichment-result.json",
      "digest": "sha256:e468e4337bca2ada9a8c325577c20bebbaa0e6c6895d2ad872fd3ad839bd6b91"
    },
    {
      "path": "schemas/knowledge-graph.json",
      "source": "src/claude/schemas/knowledge-graph.json",
      "digest": "sha256:2966dd1372d5689d1272b5d751b66e427caa6857b1b149f1d8de3681384005ae"
    },
    {
      "path": "schemas/knowledge-system.json",
      "source": "src/claude/schemas/knowledge-system.json",
      "digest": "sha256:a3a1f6c41539d21264423f11676eb6263e84520f57c94d45962213bd78b007aa"
    },
    {
      "path": "schemas/validation-evidence.json",
      "source": "src/claude/schemas/validation-evidence.json",
      "digest": "sha256:9ae5c4e116dc4e33100d25fcb808406863bad14619e901678fefeb08bcf919b6"
    },
    {
      "path": "siegard-manifest.json",
      "source": "scripts/generate_dist.py",
      "digest": "sha256:7711ef495f0286ed4ebd42a138718b0ca88ef2090ace6c9b71e8bf3f23ce9b8e"
    },
    {
      "path": "skills/ingest-domain/SKILL.md",
      "source": "src/claude/skills/ingest-domain/SKILL.md",
      "digest": "sha256:0c4853e1e5466c28112049abc45f50aa381221382012dfee95ce7143c72913d8"
    },
    {
      "path": "skills/model-domain/SKILL.md",
      "source": "src/claude/skills/model-domain/SKILL.md",
      "digest": "sha256:9f09f527b0242a6488890a9a721614e35e74a6480f76ad793e202d58cb192dd5"
    },
    {
      "path": "templates/domain-object-aggregate.md",
      "source": "src/claude/templates/domain-object-aggregate.md",
      "digest": "sha256:5eb932b183ddbd732ce781cf6e121e1f6c6cbc8fee863bdf7c904f40102e7766"
    },
    {
      "path": "templates/domain-object-context.md",
      "source": "src/claude/templates/domain-object-context.md",
      "digest": "sha256:9f309ccefcf06c171b4e30da3b853c2253afe6b6d95ee26c73d347b47e27a778"
    },
    {
      "path": "templates/domain-object-definition.md",
      "source": "src/claude/templates/domain-object-definition.md",
      "digest": "sha256:cdf15d1c66a723ef4a5afd57c322e9e2640c9ca6004444de2866de75caaeb0d2"
    },
    {
      "path": "templates/domain-object-interface.md",
      "source": "src/claude/templates/domain-object-interface.md",
      "digest": "sha256:39544b494fe4f2f2312e43c32792d8d947e437dfe0f04575bb77681b38819e4c"
    },
    {
      "path": "templates/domain-object-lifecycle.md",
      "source": "src/claude/templates/domain-object-lifecycle.md",
      "digest": "sha256:0818bf897939227b7bafcd807b0c344f4a8ee221128d4202dc5f85a203f473d6"
    },
    {
      "path": "templates/domain-object-process.md",
      "source": "src/claude/templates/domain-object-process.md",
      "digest": "sha256:3734705351557f5ab9e78461ddd848b29542dcfb28bab94873335b452915a7aa"
    },
    {
      "path": "templates/domain-object-rule.md",
      "source": "src/claude/templates/domain-object-rule.md",
      "digest": "sha256:9ab507d0fb1ed128c3742e79101b968b8d40ca8679a4b57b3f29bdb99912a117"
    },
    {
      "path": "templates/domain-object-subdomain.md",
      "source": "src/claude/templates/domain-object-subdomain.md",
      "digest": "sha256:d46a6903d9f9ead62540f001989fed041262fe6a9e9a33903265912073363ee2"
    },
    {
      "path": "templates/knowledge-decision.md",
      "source": "src/claude/templates/knowledge-decision.md",
      "digest": "sha256:29528594831ef087ef130845d73c8ecd3a9d07930032da3ddd80ccdaf52216df"
    },
    {
      "path": "templates/knowledge-system.md",
      "source": "src/claude/templates/knowledge-system.md",
      "digest": "sha256:fd94977582093cbd2df19fa9f44a2f26af1a421d6b1d7d54acc10dcd00f8af07"
    },
    {
      "path": "templates/validation-evidence.md",
      "source": "src/claude/templates/validation-evidence.md",
      "digest": "sha256:d9cb0ed5458f7304b012f820cc54a8bf1fbe93ff90740a4e399c0a3b35b0bc68"
    }
  ],
  "schemas": [
    {
      "contract_version": "analysis-record/1",
      "path": "schemas/analysis-record.json"
    },
    {
      "contract_version": "analysis-seal/1",
      "path": "schemas/analysis-seal.json"
    },
    {
      "contract_version": "distribution-manifest/2",
      "path": "schemas/distribution-manifest.json"
    },
    {
      "contract_version": "domain-object/1",
      "path": "schemas/domain-object.json"
    },
    {
      "contract_version": "impact-analysis/5",
      "path": "schemas/impact-analysis.json"
    },
    {
      "contract_version": "knowledge-decision/2",
      "path": "schemas/knowledge-decision.json"
    },
    {
      "contract_version": "knowledge-enrichment-result/2",
      "path": "schemas/knowledge-enrichment-result.json"
    },
    {
      "contract_version": "knowledge-graph/2",
      "path": "schemas/knowledge-graph.json"
    },
    {
      "contract_version": "knowledge-system/1",
      "path": "schemas/knowledge-system.json"
    },
    {
      "contract_version": "validation-evidence/3",
      "path": "schemas/validation-evidence.json"
    }
  ],
  "capabilities": [
    {
      "name": "check-field-ownership",
      "class": "script",
      "status": "active",
      "path": "bin/check_field_ownership.py",
      "declaration": {
        "objective": "Hold the enrichment pass to the four fields and the body it owns, by comparing each object against the seal the analysis left. Choose it after enrichment and before anything is read from the base. It is the only thing enforcing that restriction: a tool grant names tools, not the keys of a file, so `Edit` confined to four fields is prose until something checks it. Not for validating an object against its contract, which is a boundary check, and not for judging what the enrichment wrote.",
        "inputs": [
          {
            "name": "analysis_seal",
            "artifact": "analysis-seal",
            "contract": "analysis-seal/1",
            "required": true
          },
          {
            "name": "root",
            "required": true
          }
        ],
        "outputs": [],
        "consumed_artifacts": [
          {
            "artifact": "analysis-seal",
            "access": "read"
          },
          {
            "artifact": "domain-object",
            "access": "read"
          }
        ],
        "required_context": {
          "note": "No kind is in scope. It compares two renderings of the same objects and reads nothing about what they mean."
        },
        "deterministic_behavior": [
          "what the analysis wrote is read from the seal rather than re-derived: a producer that writes by judgment offers no function to run again, and two runs over one request agree in meaning and not in bytes",